{
  "actor": "jdoe",
  "commit_sha": "abc123def4567890abc123def4567890abc123de",
  "plan_hash": "9f2c1a7b3e4d5f60718293a4b5c6d7e8f90112233445566778899aabbccddeeff",
  "timestamp": "2026-10-15T12:00:00Z",
  "environment": "prod",
  "module": "network",
  "outcome": "success",
  "pipeline_id": "1001",
  "job_id": "5001",
  "project_path": "kaas/pipelines/strata-pipeline-vnext",
  "mr_ref": "142"
}
