{
  "actor": "asmith",
  "commit_sha": "zzz999888777666555444333222111000fffeeee",
  "plan_hash": "0011223344556677889900aabbccddeeff00112233445566778899aabbccddee",
  "timestamp": "2026-10-20T09:30:00Z",
  "environment": "dev",
  "module": "keyvault",
  "outcome": "failure",
  "pipeline_id": "1002",
  "job_id": "5002",
  "project_path": "kaas/pipelines/strata-pipeline-vnext",
  "mr_ref": "143"
}
